{
  "schema_version": "1.0.0",
  "repo": {
    "owner": "trimble-oss",
    "name": "modus-wc-2.0",
    "default_branch": "main",
    "url": "https://github.com/trimble-oss/modus-wc-2.0"
  },
  "automations": [
    {
      "name": "Dev Agent",
      "role": "dev",
      "trigger": "issue comment /approve (Me); PR /ask,/refine (Me); label qa-failed",
      "repo_scope": "trimble-oss/modus-wc-2.0",
      "tools_mcp": ["github"],
      "stop_rule": "opens PR, posts Routing block, adds routing label; never claims QA passed",
      "repair_cap": null,
      "instructions_summary": "Source: harness/AUTOMATION-PROMPTS.md and harness/console-paste/dev-append.txt",
      "enabled": true
    },
    {
      "name": "QA Agent",
      "role": "qa",
      "trigger": "label added qa-full / qa-skip / qa-rerun (not PR opened)",
      "repo_scope": "trimble-oss/modus-wc-2.0",
      "tools_mcp": ["github", "playwright"],
      "stop_rule": "one verdict: ## QA PASSED / FAILED / SKIPPED / BLOCKED",
      "repair_cap": null,
      "instructions_summary": "Source: harness/console-paste/qa-replace-steps.txt",
      "enabled": true
    },
    {
      "name": "Fix Agent",
      "role": "fix",
      "trigger": "inactive; qa-failed is handled by Dev",
      "repo_scope": "trimble-oss/modus-wc-2.0",
      "tools_mcp": ["github"],
      "stop_rule": "max 3 iterations then needs-human",
      "repair_cap": 3,
      "instructions_summary": "Source: harness/console-paste/fix-append.txt; CONSOLE-TRIGGERS.md says Inactive",
      "enabled": false
    }
  ],
  "setup_declared": {
    "has_rules": true,
    "has_mcp": true,
    "has_hooks": true,
    "has_ci_gate": true,
    "has_review_bot": true,
    "label_handoff": true,
    "human_review_always": true,
    "notes": "Rules, hooks and label router verified in origin/main. Automation definitions come from harness/ docs in this repo, not read from the console."
  },
  "prs": [
    {
      "url_or_number": "https://github.com/trimble-oss/modus-wc-2.0/pull/1544",
      "title": "Modal: Fix show code for hidden scrollbar story",
      "linked_issue": "#1543",
      "labels": ["bug"],
      "ci_status": "pass",
      "files_changed": 2,
      "lines_changed": 401,
      "agent_claimed_done": false,
      "qa_comments_summary": "Human-authored. Copilot review commented one finding, fixed by Copilot Autofix; human approved 'Moving to QA'; tester commented 'Testing completed and ready to merge'. Merged 2026-09-29. No Routing or QA-verdict comments.",
      "fix_iterations": 0,
      "human_review_notes": "Approved by ElishaSamPeterPrabhu after one Copilot finding",
      "formula_signals": {"recovery_seen": ["ci_gate", "review_bot"]}
    },
    {
      "url_or_number": "https://github.com/trimble-oss/modus-wc-2.0/pull/1562",
      "title": "Tooltip:Fix Shadow Dom Story",
      "linked_issue": "#1557",
      "labels": ["bug"],
      "ci_status": "pass",
      "files_changed": 1,
      "lines_changed": 102,
      "agent_claimed_done": false,
      "qa_comments_summary": "Human-authored. Copilot reviewed, author pushed 'Fix Review comments', human approved 'Moving to QA'. Open, no Routing or QA-verdict comments.",
      "fix_iterations": 0,
      "human_review_notes": "Approved after one review-fix commit",
      "formula_signals": {"recovery_seen": ["ci_gate", "review_bot"]}
    },
    {
      "url_or_number": "https://github.com/trimble-oss/modus-wc-2.0/pull/1565",
      "title": "Tooltip: Fix dismissEscape event in storybook",
      "linked_issue": "#1555",
      "labels": ["bug"],
      "ci_status": "pass",
      "files_changed": 1,
      "lines_changed": 10,
      "agent_claimed_done": false,
      "qa_comments_summary": "Human-authored. Copilot flagged that runtime focus-containment behavior required by #1555 is still unimplemented; human approved 'Moving to QA' on the same commit. Open.",
      "fix_iterations": 0,
      "human_review_notes": "Approved while an open Copilot finding remained",
      "what_failed_or_surprised": "Copilot says the issue's runtime behavior is not implemented; PR only fixes Storybook logging",
      "formula_signals": {"recovery_seen": ["ci_gate", "review_bot"]}
    }
  ],
  "goals": [
    "Test workflow-measure-handoff and the intake/score CLI on real official PRs",
    "Disclose provenance for every number"
  ]
}
